{
  "broker": "qmt",
  "account_id": "a",
  "trading_day": "2026-07-02",
  "trade_id": "t1",
  "broker_order_id": "b1",
  "instrument_id": "600000.XSHG",
  "side": "BUY",
  "position_effect": "AUTO",
  "price": "10.01",
  "quantity": 100,
  "trade_time": "2026-07-02T02:00:00Z",
  "received_at": "2026-07-02T02:00:00Z",
  "order_id": "550e8400-e29b-41d4-a716-446655440000",
  "client_order_id": "client-1",
  "commission": "0.01000000",
  "tax": "0",
  "broker_sequence": 1
}
