{
  "broker": "qmt",
  "account_id": "a",
  "trading_day": "2026-07-02",
  "trade_id": "t1",
  "broker_order_id": "b1",
  "instrument_id": "600000.XSHG",
  "side": "BUY",
  "position_effect": "AUTO",
  "price": "10.01",
  "quantity": 100,
  "trade_time": "2026-07-02T02:00:00Z",
  "received_at": "2026-07-02T02:00:00Z"
}
